{
  "id": "health_potion_small",
  "name": "Small Health Potion",
  "description": "Restores 30 HP",
  "type": "consumable",
  "rarity": "common",
  "stackable": true,
  "max_stack": 50,
  "price": 15,
  "consumable_data": {
    "uses": 1
  },
  "effects": [
    {
      "effect_id": "heal",
      "trigger": "on_use",
      "power": 30
    }
  ]
}

